{
  "$schema": "https://json-schema.org/draft/2020-12/schema",
  "$id": "https://coworkevobench.local/schemas/task-metadata.schema.json",
  "title": "任务研究元数据",
  "type": "object",
  "additionalProperties": false,
  "required": [
    "task_id",
    "domain",
    "task_family",
    "taxonomy_version",
    "operation_types",
    "input_modalities",
    "dependency_scope",
    "constraint_profiles",
    "deliverable_types",
    "output_filenames",
    "capability_ids",
    "supplier_capability_ids",
    "difficulty_level",
    "difficulty_tier",
    "multimodal",
    "web_search_required",
    "estimated_minutes",
    "provenance_id",
    "leakage_group_id",
    "publishability"
  ],
  "properties": {
    "task_id": {
      "type": "string",
      "pattern": "^[a-z0-9][a-z0-9._-]*/[a-z0-9][a-z0-9._-]*$"
    },
    "domain": {
      "enum": ["ppt", "docx", "xlsx", "cross_office"]
    },
    "task_family": {
      "type": "string",
      "minLength": 1
    },
    "taxonomy_version": {
      "const": "v0.2"
    },
    "operation_types": {
      "type": "array",
      "minItems": 1,
      "uniqueItems": true,
      "items": {
        "enum": ["create", "edit", "transform", "analyze", "audit", "repair", "package", "orchestrate"]
      }
    },
    "input_modalities": {
      "type": "array",
      "minItems": 1,
      "uniqueItems": true,
      "items": {
        "enum": ["plain_text", "document", "spreadsheet", "presentation", "image", "multi_file", "workspace"]
      }
    },
    "dependency_scope": {
      "enum": ["single_file", "multi_file", "cross_app", "workspace"]
    },
    "constraint_profiles": {
      "type": "array",
      "minItems": 1,
      "uniqueItems": true,
      "items": {
        "enum": [
          "content_fidelity",
          "numeric_accuracy",
          "formula_correctness",
          "layout_fidelity",
          "style_consistency",
          "preservation",
          "cross_artifact_consistency",
          "traceability",
          "professional_readiness"
        ]
      }
    },
    "sector": { "type": "string" },
    "occupation": { "type": "string" },
    "deliverable_types": {
      "type": "array",
      "minItems": 1,
      "uniqueItems": true,
      "items": {
        "enum": ["pptx", "docx", "xlsx", "pdf", "html", "other"]
      }
    },
    "output_filenames": {
      "type": "array",
      "minItems": 1,
      "uniqueItems": true,
      "items": {
        "type": "string",
        "pattern": "^[^/]+\\.[A-Za-z0-9]+$"
      }
    },
    "capability_ids": {
      "type": "array",
      "minItems": 1,
      "uniqueItems": true,
      "items": {
        "type": "string",
        "pattern": "^K([1-9]|1[0-3])$"
      }
    },
    "supplier_capability_ids": {
      "type": "array",
      "minItems": 1,
      "uniqueItems": true,
      "items": {
        "type": "string",
        "pattern": "^C([1-9]|1[0-3])$"
      }
    },
    "difficulty_level": {
      "enum": ["unassigned", "L1", "L2", "L3", "L4"]
    },
    "difficulty_tier": {
      "enum": ["unassigned", "easy", "medium", "hard", "expert"]
    },
    "multimodal": { "type": "boolean" },
    "web_search_required": { "type": "boolean" },
    "language": {
      "enum": ["zh-CN", "en-US", "ru-RU", "bilingual"]
    },
    "judge_types": {
      "type": "array",
      "minItems": 1,
      "uniqueItems": true,
      "items": {
        "enum": ["deterministic", "semantic", "visual", "hybrid"]
      }
    },
    "estimated_minutes": { "type": "integer", "minimum": 1 },
    "provenance_id": { "type": "string", "minLength": 1 },
    "leakage_group_id": { "type": "string", "minLength": 1 },
    "publishability": {
      "enum": ["public", "restricted", "sealed", "prohibited"]
    },
    "notes": { "type": "string" }
  },
  "oneOf": [
    {
      "properties": {
        "difficulty_level": { "const": "unassigned" },
        "difficulty_tier": { "const": "unassigned" }
      }
    },
    {
      "properties": {
        "difficulty_level": { "const": "L1" },
        "difficulty_tier": { "const": "easy" }
      }
    },
    {
      "properties": {
        "difficulty_level": { "const": "L2" },
        "difficulty_tier": { "const": "medium" }
      }
    },
    {
      "properties": {
        "difficulty_level": { "const": "L3" },
        "difficulty_tier": { "const": "hard" }
      }
    },
    {
      "properties": {
        "difficulty_level": { "const": "L4" },
        "difficulty_tier": { "const": "expert" }
      }
    }
  ]
}
