{
  "task_id": "cowork-evo/pptarena-082-thin-dark-gray-slide-borders",
  "domain": "ppt",
  "task_family": "visual_editing",
  "taxonomy_version": "v0.2",
  "operation_types": ["edit"],
  "input_modalities": ["presentation"],
  "dependency_scope": "single_file",
  "constraint_profiles": ["content_fidelity", "layout_fidelity", "style_consistency", "preservation", "professional_readiness"],
  "deliverable_types": ["pptx"],
  "output_filenames": ["AddSlideBorderGroundTruthB_AccountantCVResume.pptx"],
  "capability_ids": ["K1", "K7", "K8", "K9", "K13"],
  "supplier_capability_ids": ["C3", "C4", "C10", "C11"],
  "sector": "人力资源与招聘",
  "occupation": "财会简历演示文稿编辑",
  "difficulty_level": "unassigned",
  "difficulty_tier": "unassigned",
  "multimodal": false,
  "web_search_required": false,
  "language": "zh-CN",
  "judge_types": ["deterministic"],
  "estimated_minutes": 8,
  "provenance_id": "pptarena/case-082@6f26a63ec1014b98c44990c7b58133b832070be2",
  "leakage_group_id": "pptarena-case-082-add-slide-border",
  "publishability": "public",
  "notes": "保留 PPTArena Case 82 的原始 4 页竖版 PPTX 和全页统一边框意图；上游 Golden 经逐页对象、OOXML 和渲染审计合格。候选设计目标为 L1，正式难度待 Agent Rollout。"
}
