{
  "task_id": "cowork-evo/officeval-060-single-slide-image-layout-repair",
  "domain": "ppt",
  "task_family": "visual_editing",
  "taxonomy_version": "v0.2",
  "operation_types": ["edit", "repair"],
  "input_modalities": ["presentation"],
  "dependency_scope": "single_file",
  "constraint_profiles": ["layout_fidelity", "preservation", "professional_readiness"],
  "deliverable_types": ["pptx"],
  "output_filenames": ["PPT_slide4_relayout.pptx"],
  "capability_ids": ["K1", "K7", "K8", "K9", "K13"],
  "supplier_capability_ids": ["C3", "C4", "C10", "C11"],
  "sector": "工业水处理",
  "occupation": "演示文稿版式修复",
  "difficulty_level": "unassigned",
  "difficulty_tier": "unassigned",
  "multimodal": true,
  "web_search_required": false,
  "language": "zh-CN",
  "judge_types": ["deterministic"],
  "estimated_minutes": 5,
  "provenance_id": "omegause-officeval/officeval_060@ffbeecb8752447c8e40b594a0eeb1db7236ecb36",
  "leakage_group_id": "omegause-officeval-060",
  "publishability": "public",
  "notes": "原始 5 页 PPTX、Query、Rubric 与 Verifier 均来自 OmegaUse-OfficeVal officeval_060；Golden 仅改写第 4 页 XML，并保持其他包成员逐字节不变。"
}
