{
  "task_id": "cowork-evo/forte-finance-018-receivables-payables-consolidation",
  "domain": "xlsx",
  "task_family": "multi_workbook_integration",
  "taxonomy_version": "v0.2",
  "operation_types": ["transform", "analyze", "audit", "package"],
  "input_modalities": ["spreadsheet", "multi_file"],
  "dependency_scope": "multi_file",
  "constraint_profiles": ["content_fidelity", "numeric_accuracy", "preservation", "cross_artifact_consistency", "traceability", "professional_readiness"],
  "deliverable_types": ["xlsx"],
  "output_filenames": ["往来款跨期整合.xlsx"],
  "capability_ids": ["K1", "K2", "K3", "K5", "K7", "K10", "K11", "K12", "K13"],
  "supplier_capability_ids": ["C1", "C2", "C3", "C5", "C6", "C8", "C10", "C12", "C13"],
  "sector": "财务与会计",
  "occupation": "往来账会计",
  "difficulty_level": "unassigned",
  "difficulty_tier": "unassigned",
  "multimodal": false,
  "web_search_required": false,
  "language": "zh-CN",
  "judge_types": ["deterministic", "visual"],
  "estimated_minutes": 120,
  "provenance_id": "forte/Finance-018@345c1ec1487139db9dd319787fa9405ba85d1869",
  "leakage_group_id": "forte-finance-018-receivables-payables",
  "publishability": "public",
  "notes": "author_hypothesis=L4; calibration_status=pilot_single_panel; review_status=pending_human_review; CSV/text answers and replay processor remain evaluation-side while solver delivers only the integrated workbook."
}
