{
  "task_id": "cowork-evo/officebench-3-8-revenue-threshold-report-package",
  "domain": "cross_office",
  "task_family": "shared_source_multi_output",
  "taxonomy_version": "v0.2",
  "operation_types": ["analyze", "transform", "create", "package"],
  "input_modalities": ["spreadsheet"],
  "dependency_scope": "cross_app",
  "constraint_profiles": ["content_fidelity", "numeric_accuracy", "formula_correctness", "cross_artifact_consistency", "traceability", "professional_readiness"],
  "deliverable_types": ["xlsx", "docx"],
  "output_filenames": ["Revenue_Filtered_Analysis.xlsx", "Revenue_Threshold_Report.docx"],
  "capability_ids": ["K1", "K3", "K4", "K6", "K7", "K10", "K11", "K12"],
  "supplier_capability_ids": ["C2", "C7", "C10", "C12"],
  "sector": "企业经营分析",
  "occupation": "收入分析专员",
  "difficulty_level": "unassigned",
  "difficulty_tier": "unassigned",
  "multimodal": false,
  "web_search_required": false,
  "language": "zh-CN",
  "judge_types": ["deterministic", "visual"],
  "estimated_minutes": 75,
  "provenance_id": "officebench/task-3-8-subtask-0@b978b808667c32b52ce19a67ce1def1de9ae02b7",
  "leakage_group_id": "officebench-3-8-company-revenues",
  "publishability": "public",
  "notes": "逐题完整阅读 OfficeBench 3-8 的全部 8 个 subtask、共享 testbed、原 Evaluator 和许可证后选择 subtask 0；结构设计目标为 L2/Medium，正式难度等待冻结多 Harness Rollout。"
}
