{
  "task_id": "cowork-evo/cowork-bench-sf-regional-sales-forecast",
  "domain": "xlsx",
  "task_family": "model_building",
  "taxonomy_version": "v0.2",
  "operation_types": [
    "orchestrate",
    "analyze",
    "package"
  ],
  "input_modalities": [
    "spreadsheet",
    "document",
    "multi_file"
  ],
  "dependency_scope": "multi_file",
  "constraint_profiles": [
    "numeric_accuracy",
    "cross_artifact_consistency",
    "traceability",
    "professional_readiness"
  ],
  "deliverable_types": [
    "xlsx",
    "docx"
  ],
  "output_filenames": [
    "Sales_Forecast.xlsx",
    "Forecast_Report.docx"
  ],
  "capability_ids": [
    "K1",
    "K2",
    "K4",
    "K5",
    "K6",
    "K10"
  ],
  "supplier_capability_ids": [
    "C7",
    "C8",
    "C10",
    "C12"
  ],
  "sector": "财务计划与销售预测",
  "occupation": "FP&A 分析师",
  "difficulty_level": "unassigned",
  "difficulty_tier": "unassigned",
  "multimodal": false,
  "web_search_required": false,
  "language": "ru-RU",
  "judge_types": [
    "deterministic"
  ],
  "estimated_minutes": 90,
  "provenance_id": "cowork-bench/sf-regional-sales-forecast@d943e75bc0fc8e3b27141979300cd8cbcd1e890d",
  "leakage_group_id": "cowork-bench-sales-dw-q4-2025",
  "publishability": "public",
  "notes": "原题的 ClickHouse、经济指标 HTTP API 和 Google Sheets 已静态化；保留上游 Excel+Word 双交付意图，不执行在线副作用。"
}
