{
  "task_id":"cowork-evo/theagentcompany-customer-meeting-openhands-capability-deck",
  "domain":"ppt",
  "task_family":"audience_adaptation",
  "taxonomy_version":"v0.2",
  "operation_types":["analyze","audit","create","orchestrate"],
  "input_modalities":["plain_text","multi_file","workspace"],
  "dependency_scope":"multi_file",
  "constraint_profiles":["content_fidelity","cross_artifact_consistency","traceability","professional_readiness"],
  "deliverable_types":["pptx","other"],
  "output_filenames":["openhands_intro.pptx","Delivery_Record.json"],
  "capability_ids":["K1","K2","K3","K4","K5","K6","K7","K8","K9","K11","K12","K13"],
  "supplier_capability_ids":["C1","C2","C3","C4","C5","C6","C7","C9","C10","C13"],
  "sector":"AI 代理与客户方案",
  "occupation":"客户会前能力沟通",
  "difficulty_level":"unassigned",
  "difficulty_tier":"unassigned",
  "multimodal":false,
  "web_search_required":false,
  "language":"zh-CN",
  "judge_types":["deterministic"],
  "estimated_minutes":120,
  "provenance_id":"theagentcompany/pm-prepare-meeting-with-customers@98b68ef82a47690c316f42fddb05baafaab56851",
  "leakage_group_id":"theagentcompany-openhands-customer-meeting",
  "publishability":"public",
  "notes":"原始 GitLab + RocketChat 任务的离线 Harbor 适配；以上游 evaluator 分组为证据真值，不将 benchmark entry 夸大为已测性能。候选设计目标为 L4，正式难度待 Agent Rollout。"
}
