{
  "task_id": "cowork-evo/officeval-040-advanced-formatting-and-watermark", "domain": "docx", "task_family": "formatting_fidelity", "taxonomy_version": "v0.2",
  "operation_types": ["edit", "transform"], "input_modalities": ["document", "image", "multi_file"], "dependency_scope": "multi_file",
  "constraint_profiles": ["content_fidelity", "layout_fidelity", "style_consistency", "preservation", "professional_readiness"], "deliverable_types": ["docx"],
  "output_filenames": ["简介素材_格式设置_水印版.docx"], "capability_ids": ["K1", "K7", "K9", "K12"], "supplier_capability_ids": ["C2", "C7", "C10"],
  "sector": "职业教育与院系宣传", "occupation": "Word 高级排版编辑", "difficulty_level": "L4", "difficulty_tier": "expert", "multimodal": true, "web_search_required": false,
  "language": "zh-CN", "judge_types": ["deterministic"], "estimated_minutes": 190,
  "provenance_id": "omegause-officeval/officeval_040@ffbeecb8752447c8e40b594a0eeb1db7236ecb36", "leakage_group_id": "omegause-officeval-040", "publishability": "public",
  "notes": "原 Query、DOCX、校园横幅图、Rubric 与 Verifier 来自 OmegaUse-OfficeVal officeval_040；Golden 保留全部原文，仅调整段界以使指定短语成为第三个可见段。; calibration_status=pilot_single_panel; difficulty_source=benchmarks/difficulty-labels-v0.5.csv"
}
