{
  "task_id": "cowork-evo/cowork-bench-student-retention-workspace-package",
  "domain": "cross_office",
  "task_family": "workspace_orchestration",
  "taxonomy_version": "v0.2",
  "operation_types": ["transform", "analyze", "create", "package", "orchestrate"],
  "input_modalities": ["document", "spreadsheet", "multi_file", "workspace"],
  "dependency_scope": "workspace",
  "constraint_profiles": ["content_fidelity", "numeric_accuracy", "formula_correctness", "cross_artifact_consistency", "traceability", "professional_readiness"],
  "deliverable_types": ["xlsx", "docx", "other"],
  "output_filenames": ["risk_scorer.py", "risk_analysis_results.json", "Student_Risk_Analysis.xlsx", "Intervention_Plan.docx", "Student_Risk_Tracker.md", "advisor_email.txt"],
  "capability_ids": ["K1", "K2", "K3", "K4", "K5", "K8", "K10", "K11", "K12", "K13"],
  "supplier_capability_ids": ["C1", "C2", "C3", "C4", "C5", "C7", "C8", "C10", "C12", "C13"],
  "sector": "高等教育",
  "occupation": "教学运营与学生成功分析师",
  "difficulty_level": "L1",
  "difficulty_tier": "easy",
  "multimodal": false,
  "web_search_required": false,
  "language": "bilingual",
  "judge_types": ["deterministic"],
  "estimated_minutes": 210,
  "provenance_id": "cowork-bench/terminal-canvas-excel-word-teamly-email@d943e75bc0fc8e3b27141979300cd8cbcd1e890d",
  "leakage_group_id": "cowork-bench-student-retention-canvas-snapshot",
  "publishability": "public",
  "notes": "人工阅读原始 Query、preprocess、Evaluator、PDF、冻结 Golden 与 LICENSE 后逐题改造。Canvas 动态读取被同一上游 SQL 快照的逐行字段投影替代，Teamly 页面与邮件副作用分别静态化为 Markdown 和离线草稿；Judge 从源行独立重算并执行分数变异回放。; calibration_status=pilot_single_panel; difficulty_source=benchmarks/difficulty-labels-v0.5.csv"
}
